{
  "schema": "combine-tool-channel-manifest-v1",
  "schema_version": 1,
  "channel": "test",
  "addon_version": "0.3.109",
  "build_id": "test-123-a1b2c3d4",
  "commit_sha": "0123456789abcdef0123456789abcdef01234567",
  "published_at": "2026-10-01T00:00:00Z",
  "blender_min": [
    4,
    4,
    3
  ],
  "blender_max": null,
  "archive": {
    "url": "https://github.com/Bezdush/combine-tool-release/releases/download/test-v0.3.109%2Btest-123-a1b2c3d4/combine_tool_test-123-a1b2c3d4.zip",
    "name": "combine_tool_test-123-a1b2c3d4.zip",
    "size": 1,
    "sha256": "0000000000000000000000000000000000000000000000000000000000000000"
  },
  "release_notes": "Example only; signature is not trusted.",
  "source_release_tag": "test-v0.3.109+test-123-a1b2c3d4",
  "signature": {
    "algorithm": "ed25519",
    "key_id": "example-key",
    "value": "AAAAAAAAAAAAAAAAAAAAAAAAAAAAAAAAAAAAAAAAAAAAAAAAAAAAAAAAAAAAAAAAAAAAAAAAAAAAAAAAAAAAAA=="
  }
}
